{
  "$schema": "http://json-schema.org/draft-07/schema#",
  "type": "object",
  "properties": {
    "name": {
      "type": "string",
      "description": "The name of the project"
    },
    "description": {
      "type": "string",
      "description": "A short description of the project"
    },
    "homepage": {
      "type": "string",
      "description": "A link to the project's homepage"
    },
    "version": {
      "type": "string",
      "description": "The version of the package being installed"
    },
    "sha256": {
      "type": "object",
      "description": "Platform-specific SHA256 checksums",
      "patternProperties": {
        "^(linux|macos|windows)-(arm64|x64)$": {
          "type": "string",
          "description": "SHA256 checksum for a specific platform (e.g., linux-x64, macos-arm64)"
        }
      },
      "additionalProperties": false
    },
    "url": {
      "type": "object",
      "description": "Platform-specific URLs",
      "patternProperties": {
        "^(linux|macos|windows)-(arm64|x64)$": {
          "type": "string",
          "description": "URL for a specific platform (e.g., linux-x64, macos-arm64)"
        }
      },
      "additionalProperties": false
    },
    "dependencies": {
      "type": "array",
      "description": "Other packages that this package depends on",
      "items": { "type": "string" }
    },
    "caveats": {
      "type": "string",
      "description": "Extra information the user should know after installation completes, such as setup information"
    },
    "scripts": {
      "type": "object",
      "description": "Scripts configuration",
      "properties": {
        "install": {
          "type": "object",
          "description": "Platform-specific install scripts",
          "patternProperties": {
            "^(linux|macos|windows)-(arm64|x64)$": {
              "type": "array",
              "description": "Install script for a specific platform",
              "items": { "type": "string" }
            }
          }
        },
        "latest": {
          "type": "array",
          "description": "Global latest version check script for all platforms",
          "items": { "type": "string" },
          "default": [
            "gh release list -R OWNER/REPO --json tagName --jq '.[0].tagName' | cut -c 2-"
          ]
        },
        "completions": {
          "type": "object",
          "description": "Platform-specific completions installation scripts",
          "patternProperties": {
            "^(linux|macos|windows)-(arm64|x64)$": {
              "type": "array",
              "description": "Completions installation script for a specific platform",
              "items": { "type": "string" }
            }
          }
        }
      },
      "required": ["install", "latest"]
    }
  },
  "required": [
    "name",
    "description",
    "homepage",
    "version",
    "sha256",
    "url",
    "scripts"
  ],
  "description": "Package configuration schema. All packages must provide platform-specific sha256, url, and scripts configurations."
}
