{
  "$schema": "../package.schema.json",
  "name": "pkg",
  "description": "A simple cross-platform package manager",
  "homepage": "https://pkg.zerolimits.dev",
  "version": "0.3.0",
  "sha256": {
    "macos-arm64": "7256f53426e39efd92272891aa9eff641417409d20866d5bcb2257927b62f232"
  },
  "url": {
    "macos-arm64": "https://github.com/noClaps/pkg/releases/download/v{{ version }}/pkg.tar.xz"
  },
  "scripts": {
    "install": {
      "macos-arm64": [
        "tar -xf pkg.tar.xz",
        "install pkg {{ pkg.bin_dir }}/pkg"
      ]
    },
    "latest": [
      "gh release list -R noClaps/pkg --json tagName --jq '.[0].tagName' | cut -c 2-"
    ],
    "completions": {
      "macos-arm64": [
        "pkg --completions zsh > {{ pkg.completions.zsh }}/_pkg"
      ]
    }
  }
}
