{
  "$schema": "../package.schema.json",
  "name": "node",
  "description": "Node.js JavaScript runtime",
  "homepage": "https://nodejs.org",
  "version": "24.7.0",
  "sha256": {
    "linux-arm64": "04df0283d2a8a06271a690fbe2528661527b3a09f0f28c8bb63327d8888be184",
    "linux-x64": "8cf85258402e056efa041168c9b162a4e3b229ebfad5000850b8941c974e9d5a",
    "macos-arm64": "ff8298faaf82c85444aad7f1e12a4882496286ea9008702029b359d7fac7f8b3",
    "macos-x64": "b99548ef56ec86da2ce50eff041d97e14077b77b517c4bcce0925d14c26cbee3"
  },
  "url": {
    "linux-arm64": "https://nodejs.org/dist/v{{ version }}/node-v{{ version }}-linux-arm64.tar.gz",
    "linux-x64": "https://nodejs.org/dist/v{{ version }}/node-v{{ version }}-linux-x64.tar.gz",
    "macos-arm64": "https://nodejs.org/dist/v{{ version }}/node-v{{ version }}-darwin-arm64.tar.gz",
    "macos-x64": "https://nodejs.org/dist/v{{ version }}/node-v{{ version }}-darwin-x64.tar.gz"
  },
  "scripts": {
    "install": {
      "linux-arm64": [
        "tar -xf node-v{{ version }}-linux-arm64.tar.gz",
        "mv node-v{{ version }}-linux-arm64 {{ pkg.opt_dir }}/node",
        "ln -sf {{ pkg.opt_dir }}/node/bin/* {{ pkg.bin_dir }}"
      ],
      "linux-x64": [
        "tar -xf node-v{{ version }}-linux-x64.tar.gz",
        "mv node-v{{ version }}-linux-x64 {{ pkg.opt_dir }}/node",
        "ln -sf {{ pkg.opt_dir }}/node/bin/* {{ pkg.bin_dir }}"
      ],
      "macos-arm64": [
        "tar -xf node-v{{ version }}-darwin-arm64.tar.gz",
        "mv node-v{{ version }}-darwin-arm64 {{ pkg.opt_dir }}/node",
        "ln -sf {{ pkg.opt_dir }}/node/bin/* {{ pkg.bin_dir }}"
      ],
      "macos-x64": [
        "tar -xf node-v{{ version }}-darwin-x64.tar.gz",
        "mv node-v{{ version }}-darwin-x64 {{ pkg.opt_dir }}/node",
        "ln -sf {{ pkg.opt_dir }}/node/bin/* {{ pkg.bin_dir }}"
      ]
    },
    "latest": [
      "curl -fsSL https://nodejs.org/dist/index.json | jq '.[0].version' -r | cut -c 2-"
    ]
  }
}
