{
  "$schema": "../package.schema.json",
  "name": "kerl",
  "description": "Easy building and installing of Erlang/OTP instances",
  "homepage": "https://github.com/kerl/kerl",
  "version": "4.4.0",
  "sha256": {
    "macos-arm64": "0f32eb08172baffdca9264c5626f6d7fd650369365079fe21f8b8ab997885d8c"
  },
  "url": {
    "macos-arm64": "https://github.com/kerl/kerl/archive/refs/tags/{{ version }}.tar.gz"
  },
  "scripts": {
    "install": {
      "macos-arm64": [
        "tar -xf {{ version }}.tar.gz",
        "install kerl-{{ version }}/kerl {{ pkg.bin_dir }}"
      ]
    },
    "latest": [
      "gh release list -R kerl/kerl --json tagName --jq '.[0].tagName'"
    ],
    "completions": {
      "macos-arm64": [
        "mv kerl-{{ version }}/zsh_completion/_kerl {{ pkg.completions.zsh }}"
      ]
    }
  }
}
