{
  "$schema": "../package.schema.json",
  "name": "zig",
  "description": "General-purpose programming language and toolchain for maintaining robust, optimal, and reusable software.",
  "homepage": "https://ziglang.org",
  "version": "0.14.1",
  "sha256": {
    "linux-arm64": "f7a654acc967864f7a050ddacfaa778c7504a0eca8d2b678839c21eea47c992b",
    "linux-x64": "24aeeec8af16c381934a6cd7d95c807a8cb2cf7df9fa40d359aa884195c4716c",
    "macos-arm64": "39f3dc5e79c22088ce878edc821dedb4ca5a1cd9f5ef915e9b3cc3053e8faefa",
    "macos-x64": "b0f8bdfb9035783db58dd6c19d7dea89892acc3814421853e5752fe4573e5f43"
  },
  "url": {
    "linux-arm64": "https://ziglang.org/download/{{ version }}/zig-aarch64-linux-{{ version }}.tar.xz",
    "linux-x64": "https://ziglang.org/download/{{ version }}/zig-x86_64-linux-{{ version }}.tar.xz",
    "macos-arm64": "https://ziglang.org/download/{{ version }}/zig-aarch64-macos-{{ version }}.tar.xz",
    "macos-x64": "https://ziglang.org/download/{{ version }}/zig-x86_64-macos-{{ version }}.tar.xz"
  },
  "scripts": {
    "completions": {
      "linux-arm64": [
        "curl -L https://github.com/ziglang/shell-completions/raw/refs/heads/master/_zig -o {{ pkg.completions.zsh }}/_zig"
      ],
      "linux-x64": [
        "curl -L https://github.com/ziglang/shell-completions/raw/refs/heads/master/_zig -o {{ pkg.completions.zsh }}/_zig"
      ],
      "macos-arm64": [
        "curl -L https://github.com/ziglang/shell-completions/raw/refs/heads/master/_zig -o {{ pkg.completions.zsh }}/_zig"
      ],
      "macos-x64": [
        "curl -L https://github.com/ziglang/shell-completions/raw/refs/heads/master/_zig -o {{ pkg.completions.zsh }}/_zig"
      ]
    },
    "install": {
      "linux-arm64": [
        "tar -xf zig-aarch64-linux-{{ version }}.tar.xz",
        "mv zig-aarch64-linux-{{ version }} {{ pkg.opt_dir }}/zig",
        "ln -sf {{ pkg.opt_dir }}/zig/zig {{ pkg.bin_dir }}"
      ],
      "linux-x64": [
        "tar -xf zig-x86_64-linux-{{ version }}.tar.xz",
        "mv zig-x86_64-linux-{{ version }} {{ pkg.opt_dir }}/zig",
        "ln -sf {{ pkg.opt_dir }}/zig/zig {{ pkg.bin_dir }}"
      ],
      "macos-arm64": [
        "tar -xf zig-aarch64-macos-{{ version }}.tar.xz",
        "mv zig-aarch64-macos-{{ version }} {{ pkg.opt_dir }}/zig",
        "ln -sf {{ pkg.opt_dir }}/zig/zig {{ pkg.bin_dir }}"
      ],
      "macos-x64": [
        "tar -xf zig-x86_64-macos-{{ version }}.tar.xz",
        "mv zig-x86_64-macos-{{ version }} {{ pkg.opt_dir }}/zig",
        "ln -sf {{ pkg.opt_dir }}/zig/zig {{ pkg.bin_dir }}"
      ]
    },
    "latest": [
      "curl -sL 'https://ziglang.org/download/index.json' | jq -r 'keys_unsorted[1]'"
    ]
  }
}
