{
  "$schema": "../package.schema.json",
  "name": "jj",
  "description": "A Git-compatible VCS that is both simple and powerful",
  "homepage": "https://jj-vcs.github.io/jj/",
  "version": "0.33.0",
  "sha256": {
    "linux-arm64": "2ce8822f2161d4eaee96ce2bc7d6f791ace38913db02487116103d41c8b58ca4",
    "linux-x64": "2703e13b3d5623aa67e19358b257fe5a761faa883bd0bd716d0b1c801a214093",
    "macos-arm64": "1ba71332ab6ddf578cfb0d74f781c3e06a48125312b31cdd44789941ff6f8b5c",
    "macos-x64": "63c48d3899b52eb26ac0a3258101fff4765f74c4ceb70eae3dd8350126a73cf5"
  },
  "url": {
    "linux-arm64": "https://github.com/jj-vcs/jj/releases/download/v{{ version }}/jj-v{{ version }}-aarch64-unknown-linux-musl.tar.gz",
    "linux-x64": "https://github.com/jj-vcs/jj/releases/download/v{{ version }}/jj-v{{ version }}-x86_64-unknown-linux-musl.tar.gz",
    "macos-arm64": "https://github.com/jj-vcs/jj/releases/download/v{{ version }}/jj-v{{ version }}-aarch64-apple-darwin.tar.gz",
    "macos-x64": "https://github.com/jj-vcs/jj/releases/download/v{{ version }}/jj-v{{ version }}-x86_64-apple-darwin.tar.gz"
  },
  "scripts": {
    "install": {
      "linux-arm64": [
        "tar -xf jj-v{{ version }}-aarch64-unknown-linux-musl.tar.gz",
        "install jj {{ pkg.bin_dir }}"
      ],
      "linux-x64": [
        "tar -xf jj-v{{ version }}-x86_64-unknown-linux-musl.tar.gz",
        "install jj {{ pkg.bin_dir }}"
      ],
      "macos-arm64": [
        "tar -xf jj-v{{ version }}-aarch64-apple-darwin.tar.gz",
        "install jj {{ pkg.bin_dir }}"
      ],
      "macos-x64": [
        "tar -xf jj-v{{ version }}-x86_64-apple-darwin.tar.gz",
        "install jj {{ pkg.bin_dir }}"
      ]
    },
    "latest": [
      "gh release list -R jj-vcs/jj --json tagName --jq '.[0].tagName' | cut -c 2-"
    ],
    "completions": {
      "linux-arm64": [
        "jj util completion zsh > {{ pkg.completions.zsh }}/_jj"
      ],
      "linux-x64": [
        "jj util completion zsh > {{ pkg.completions.zsh }}/_jj"
      ],
      "macos-arm64": [
        "jj util completion zsh > {{ pkg.completions.zsh }}/_jj"
      ],
      "macos-x64": [
        "jj util completion zsh > {{ pkg.completions.zsh }}/_jj"
      ]
    }
  }
}
