{
  "$schema": "../package.schema.json",
  "name": "typst",
  "description": "A new markup-based typesetting system that is powerful and easy to learn.",
  "homepage": "https://typst.app",
  "version": "0.13.1",
  "sha256": {
    "linux-arm64": "4f5b7ee6e57fb639019ee0f6bffcf940edad228ede6ff5269a9f05a1544ceed4",
    "linux-x64": "7d214bfeffc2e585dc422d1a09d2b144969421281e8c7f5d784b65fc69b5673f",
    "macos-arm64": "541e4f9eaca3f34ee865f81fc663e4839cb84d6253f71a372cd855b0a7283213",
    "macos-x64": "4dabfe647f7f01ed9cc13ad8196a6c7f5e16f0732821b522d50740d3a9f5207b"
  },
  "url": {
    "linux-arm64": "https://github.com/typst/typst/releases/download/v{{ version }}/typst-aarch64-unknown-linux-musl.tar.xz",
    "linux-x64": "https://github.com/typst/typst/releases/download/v{{ version }}/typst-x86_64-unknown-linux-musl.tar.xz",
    "macos-arm64": "https://github.com/typst/typst/releases/download/v{{ version }}/typst-aarch64-apple-darwin.tar.xz",
    "macos-x64": "https://github.com/typst/typst/releases/download/v{{ version }}/typst-x86_64-apple-darwin.tar.xz"
  },
  "scripts": {
    "install": {
      "linux-arm64": [
        "tar -xf typst-aarch64-unknown-linux-musl.tar.xz",
        "install typst-aarch64-unknown-linux-musl/typst {{ pkg.bin_dir }}"
      ],
      "linux-x64": [
        "tar -xf typst-x86_64-unknown-linux-musl.tar.xz",
        "install typst-x86_64-unknown-linux-musl/typst {{ pkg.bin_dir }}"
      ],
      "macos-arm64": [
        "tar -xf typst-aarch64-apple-darwin.tar.xz",
        "install typst-aarch64-apple-darwin/typst {{ pkg.bin_dir }}"
      ],
      "macos-x64": [
        "tar -xf typst-x86_64-apple-darwin.tar.xz",
        "install typst-x86_64-apple-darwin/typst {{ pkg.bin_dir }}"
      ]
    },
    "latest": [
      "gh release list -R typst/typst --json tagName --jq '.[0].tagName' | cut -c 2-"
    ]
  }
}
