{
  "$schema": "../package.schema.json",
  "name": "watchexec",
  "description": "Executes commands in response to file modifications",
  "homepage": "https://github.com/watchexec/watchexec",
  "version": "2.3.2",
  "sha256": {
    "linux-arm64": "f19c399c20bc7bfa5569b57c0244da3b926bc942e98c2a4c7f548cf1f0d65d76",
    "linux-x86_64": "f19c399c20bc7bfa5569b57c0244da3b926bc942e98c2a4c7f548cf1f0d65d76",
    "macos-arm64": "f19c399c20bc7bfa5569b57c0244da3b926bc942e98c2a4c7f548cf1f0d65d76",
    "macos-x86_64": "f19c399c20bc7bfa5569b57c0244da3b926bc942e98c2a4c7f548cf1f0d65d76"
  },
  "url": {
    "linux-arm64": "https://github.com/watchexec/watchexec/releases/download/v{{ version }}/watchexec-{{ version }}-aarch64-apple-darwin.tar.xz",
    "linux-x86_64": "https://github.com/watchexec/watchexec/releases/download/v{{ version }}/watchexec-{{ version }}-aarch64-apple-darwin.tar.xz",
    "macos-arm64": "https://github.com/watchexec/watchexec/releases/download/v{{ version }}/watchexec-{{ version }}-aarch64-apple-darwin.tar.xz",
    "macos-x86_64": "https://github.com/watchexec/watchexec/releases/download/v{{ version }}/watchexec-{{ version }}-aarch64-apple-darwin.tar.xz"
  },
  "scripts": {
    "completions": {
      "linux-arm64": [
        "cp watchexec-{{ version }}-aarch64-apple-darwin/completions/zsh {{ pkg.completions.zsh }}/_watchexec"
      ],
      "linux-x86_64": [
        "cp watchexec-{{ version }}-aarch64-apple-darwin/completions/zsh {{ pkg.completions.zsh }}/_watchexec"
      ],
      "macos-arm64": [
        "cp watchexec-{{ version }}-aarch64-apple-darwin/completions/zsh {{ pkg.completions.zsh }}/_watchexec"
      ],
      "macos-x86_64": [
        "cp watchexec-{{ version }}-aarch64-apple-darwin/completions/zsh {{ pkg.completions.zsh }}/_watchexec"
      ]
    },
    "install": {
      "linux-arm64": [
        "tar -xf watchexec-{{ version }}-aarch64-apple-darwin.tar.xz",
        "install watchexec-{{ version }}-aarch64-apple-darwin/watchexec {{ pkg.bin_dir }}/watchexec"
      ],
      "linux-x86_64": [
        "tar -xf watchexec-{{ version }}-aarch64-apple-darwin.tar.xz",
        "install watchexec-{{ version }}-aarch64-apple-darwin/watchexec {{ pkg.bin_dir }}/watchexec"
      ],
      "macos-arm64": [
        "tar -xf watchexec-{{ version }}-aarch64-apple-darwin.tar.xz",
        "install watchexec-{{ version }}-aarch64-apple-darwin/watchexec {{ pkg.bin_dir }}/watchexec"
      ],
      "macos-x86_64": [
        "tar -xf watchexec-{{ version }}-aarch64-apple-darwin.tar.xz",
        "install watchexec-{{ version }}-aarch64-apple-darwin/watchexec {{ pkg.bin_dir }}/watchexec"
      ]
    },
    "latest": [
      "gh release list -R watchexec/watchexec --json tagName --jq '.[0].tagName' | cut -c 2-"
    ]
  }
}
