{
  "$schema": "../package.schema.json",
  "name": "uv",
  "description": "An extremely fast Python package and project manager, written in Rust.",
  "homepage": "https://docs.astral.sh/uv/",
  "version": "0.8.16",
  "sha256": {
    "linux-arm64": "22a3cbaf87776b73c2657ba5d63f8565c1235b65eaf57dffda66061f7a09913b",
    "linux-x64": "fc94e50e8ef93a97d723b83faa42888e7710c4443a5b8a1af3aac2cda5390f3a",
    "macos-arm64": "87e4b51b735e8445f6c445c7b4c0398273e40d34cd192bad8158736653600cd6",
    "macos-x64": "07491a998fd741090501df9bbfe538f85568901a3a66c9e0368636509158727a"
  },
  "url": {
    "linux-arm64": "https://github.com/astral-sh/uv/releases/download/{{ version }}/uv-aarch64-unknown-linux-gnu.tar.gz",
    "linux-x64": "https://github.com/astral-sh/uv/releases/download/{{ version }}/uv-x86_64-unknown-linux-gnu.tar.gz",
    "macos-arm64": "https://github.com/astral-sh/uv/releases/download/{{ version }}/uv-aarch64-apple-darwin.tar.gz",
    "macos-x64": "https://github.com/astral-sh/uv/releases/download/{{ version }}/uv-x86_64-apple-darwin.tar.gz"
  },
  "scripts": {
    "install": {
      "linux-arm64": [
        "tar -xf uv-aarch64-unknown-linux-gnu.tar.gz",
        "install uv-aarch64-unknown-linux-gnu/* {{ pkg.bin_dir }}"
      ],
      "linux-x64": [
        "tar -xf uv-x86_64-unknown-linux-gnu.tar.gz",
        "install uv-x86_64-unknown-linux-gnu/* {{ pkg.bin_dir }}"
      ],
      "macos-arm64": [
        "tar -xf uv-aarch64-apple-darwin.tar.gz",
        "install uv-aarch64-apple-darwin/* {{ pkg.bin_dir }}"
      ],
      "macos-x64": [
        "tar -xf uv-x86_64-apple-darwin.tar.gz",
        "install uv-x86_64-apple-darwin/* {{ pkg.bin_dir }}"
      ]
    },
    "latest": [
      "gh release list -R astral-sh/uv --json tagName --jq '.[0].tagName'"
    ],
    "completions": {
      "linux-arm64": [
        "uv generate-shell-completion zsh > {{ pkg.completions.zsh }}/_uv",
        "uvx --generate-shell-completion zsh > {{ pkg.completions.zsh }}/_uvx"
      ],
      "linux-x64": [
        "uv generate-shell-completion zsh > {{ pkg.completions.zsh }}/_uv",
        "uvx --generate-shell-completion zsh > {{ pkg.completions.zsh }}/_uvx"
      ],
      "macos-arm64": [
        "uv generate-shell-completion zsh > {{ pkg.completions.zsh }}/_uv",
        "uvx --generate-shell-completion zsh > {{ pkg.completions.zsh }}/_uvx"
      ],
      "macos-x64": [
        "uv generate-shell-completion zsh > {{ pkg.completions.zsh }}/_uv",
        "uvx --generate-shell-completion zsh > {{ pkg.completions.zsh }}/_uvx"
      ]
    }
  }
}
