{
  "$schema": "../package.schema.json",
  "name": "neovim",
  "description": "hyperextensible Vim-based text editor",
  "homepage": "https://neovim.io",
  "version": "0.11.4",
  "sha256": {
    "linux-arm64": "684e4262d2296e469cb43f0d05edbbb52b960b7f117bed6b22936fc768993cd9",
    "linux-x64": "a74740047e73b2b380d63a474282814063d10650cd6cc95efa16d1713c7e616c",
    "macos-arm64": "2de9623a4aa8cedf85c51e33bf8e85e05f6f291b923cd666c04704ccf164e8b7",
    "macos-x64": "567b89138c29386f67a00fc8e26c6469c8bf0e5707dfea5e3fbaf4e21294d9eb"
  },
  "url": {
    "linux-arm64": "https://github.com/neovim/neovim/releases/download/v{{ version }}/nvim-linux-arm64.tar.gz",
    "linux-x64": "https://github.com/neovim/neovim/releases/download/v{{ version }}/nvim-linux-x86_64.tar.gz",
    "macos-arm64": "https://github.com/neovim/neovim/releases/download/v{{ version }}/nvim-macos-arm64.tar.gz",
    "macos-x64": "https://github.com/neovim/neovim/releases/download/v{{ version }}/nvim-macos-x86_64.tar.gz"
  },
  "scripts": {
    "install": {
      "linux-arm64": [
        "tar -xf nvim-linux-arm64.tar.gz",
        "mv nvim-linux-arm64 {{ pkg.opt_dir }}/nvim",
        "ln -sf {{ pkg.opt_dir }}/nvim/bin/* {{ pkg.bin_dir }}"
      ],
      "linux-x64": [
        "tar -xf nvim-linux-x86_64.tar.gz",
        "mv nvim-linux-x86_64 {{ pkg.opt_dir }}/nvim",
        "ln -sf {{ pkg.opt_dir }}/nvim/bin/* {{ pkg.bin_dir }}"
      ],
      "macos-arm64": [
        "tar -xf nvim-macos-arm64.tar.gz",
        "mv nvim-macos-arm64 {{ pkg.opt_dir }}/nvim",
        "ln -sf {{ pkg.opt_dir }}/nvim/bin/* {{ pkg.bin_dir }}"
      ],
      "macos-x64": [
        "tar -xf nvim-macos-x86_64.tar.gz",
        "mv nvim-macos-x86_64 {{ pkg.opt_dir }}/nvim",
        "ln -sf {{ pkg.opt_dir }}/nvim/bin/* {{ pkg.bin_dir }}"
      ]
    },
    "latest": [
      "gh repo view neovim/neovim --json latestRelease --jq '.latestRelease.tagName' | cut -c 2-"
    ]
  }
}
